14231,C'est pour ça que les lignées de Mages se marient entre elles et accumulent le prana des générations précédentes pour le transmettre à la suivante. Tout ça afin de donner naissance à des successeurs qui les surpassent.」,,だから魔術師は血脈を重ねて、代々の魔力を次代に積み重ねていく。自分より勝れた後継者を生むために」
14348,"「Ben, comme je viens de le dire, elle a un sale passe-temps qui consiste à voler ce qui m'appartient et à le détruire. En quatorze ans de détermination sans faille, pas une seule chose sur laquelle elle a jeté son dévolu ne s'en est sortie indemne.」",,「だから、あの人って私の持ち物を横取りしてはぶっ壊すのが趣味なのよ。苦節十四年、姉貴に目をつけられて無事だった物なんてひとつも無いもの」
14412,"「―――,",,「―――、
14413,ahem.」,,ぽこ」
14421,"C'était le travail d'un homme de fer, sans erreur ni relâche.",,あまりにも迷いのない、鉄人の作業だった。
14578,Il a toujours été facile de transformer les cheveux ou les yeux humains en matériau brut utile à la Magie. Et tout particulièrement dans le cas des femmes.,,昔っから人間の髪や目は魔術の材料になりやすいの。女の場合は殊更にね。
14635,"Alors, si la Tōko que nous connaissons a préparé un familier comme arme secrète, il doit...」",,あの橙子さんが切札になる使い魔を用意したのなら、それは」
14795,J'ai tout un tas de choses à te dire. J'aimerais aussi avoir de tes nouvelles. Et je meurs d'envie de t'expliquer pas mal de choses en ce qui concerne cette histoire.,,積もる話もある。君の近況にも興味がある。そもそも今回の件について、色々と説明したくてたまらない。
14957,"『Wood and clay will wash away,",,"『Wood and clay will wash away,』"
15378,"「J'y pouvais rien, non ? Il n'y avait plus de trains. J'aurais pu appeler un taxi, mais malheureusement, je n'avais pas d'argent sur moi.",,「仕方ないだろ。電車、終わってたんだから。タクシーを使えば良かったんだけど、あいにく持ち合わせがなくて。
15384,"「Pourquoi ? On pourrait utiliser certaines choses, mais on ne peut pas simplement parce qu'on n'a pas l'argent. Ce n'est pas terriblement frustrant, ça ?」",,「使えるものがあるのにお金がないだけで使えないんだから、それって不便って言わないか？」
15489,「Je l'ai déjà fait savoir aux gens de l'église.,,「教会の人になら、もう報せた。
15508,「............,,「…………
15509,"Si tu ne peux pas, alors tant pis.」",,出来ないなら、いいわ」
15647,「............,,「…………
15648,Vraiment ?」,,本当？」
15660,"Avez-vous besoin d'autres détails, Ritsuka ?」",,その他に説明は要りますか」
16152,"Il m'a mordue à la gorge, mâchée sur tout le corps, et en plus, il paraît que mon fémur droit avait disparu.",,喉に食い付かれる、体中好き放題噛まれまくる、あげくに右の腿なんてなくなってたそうよ。
16168,"...... On ne peut pas s'opposer à lui, un Mystère de l'Âge des Dieux, sans l'aide d'une Magie plusieurs fois millénaire. Mais dans le même temps, on n'a aucune chance de le battre à coups de poing......」",,……神代の神秘であるあいつには千年クラスの魔術じゃないと太刀打ちできない。かといって殴り合いでどうにかできる相手じゃないし……」
16192,"comment peut-il traiter le corps d'une femme d'une telle façon, ce gamin―――Hein ?」",,人の体を何だと思っているのかしらね、あのお子さ―――なぬ？」
16246,「............,,「…………
16247,Aozaki ?」,,蒼崎？」
16326,"Dans la vie, ton principal spectateur, ce n'est nul autre que toi-même. Voilà pourquoi on ne peut baisser sa garde ici-bas.」",,生きてく上で一番の観客っていうのはね、他ならぬ自分自身なのよ。だから人生っていうのは油断ならないんじゃない」
16450,"「Voilà, c'est ça. S'il y a bien une chose dans laquelle tu excelles, c'est cette adaptabilité.",,「ほら、そこです。君に勝れた部分があるとしたら、その順応性です。
16452,"Tu t'habituais à peine à cette vie remplie de bon sens que tu t'es retrouvé impliqué avec les anomalies que sont Aoko et Alice. Et pourtant, tu as conservé ta routine.",,ようやく慣れた常識の中で、青子たちという非常識と関わっても暮らしていけた事。
16457,"Pouvoir naturellement se fondre dans le paysage ou entre les arbres est une qualité magnifique, mais ne pas avoir d'égo implique ne pas avoir d'endroit où aller.",,風景に溶けこむ自然さは素晴らしい人徳ですが、自我がないという事は、居場所がないという事ですから。
16459,"「Cela dit, le fait que Yuika soit incapable de te voir allait au-delà de toute anticipation.",,「唯架にまで見えない、というのは予想以上でしたが。
16465,"Et par la même occasion, tu as vu en Aoko ce que tu ne pourras jamais obtenir.」",,そして同時に、貴方は青子に、自分ではどうしても手に入れられないものを見てしまった」
16478,"Me voilà gêné. Les mots ne suffisent pas à expliquer ce genre de chose...... Enfin, je ne réponds pas au titre de prêtre pour rien. Je vais me faire porte-parole et changer d'angle d'attaque.",,まいりましたね。こういう事は言葉を尽くすほど実感が湧かないものですが……ま、私も神父と呼ばれる身です。少し切り口を変えて代弁してみましょう。
16522,"―――Cependant, elle a rejeté ma proposition sans hésitation.",,―――しかしまぁ、躊躇なくフられました。
16741,"Pour lui, la notion de bien et de mal se basait simplement sur “l'attirance” et “le dégoût”.",,彼にとっての良し悪しの基準は、単純に「格好いい」か「格好悪い」か。
16965,"Là où elle se situait, son champ de vision était divisé en deux et il lui était impossible de confirmer visuellement la position de sa sœur cadette......!",,橙子の位置からでは視界が二つに別けられ、正面の像を視認できない……！
17230,"De son côté, Aoko ne se souciait guère des préparatifs de Tōko et ne daigna même pas lever le bras pour ajuster sa cible.",,対して、青子は意にも介さず、照準を合わせる為に腕をあげる事もなく、
17334,"Tu sais Alice, je croyais être incapable de trouver ce genre de chose.",,けれどね、有珠。そんな物は、見つからないって思っていたんだ。
17413,Les lames de tonnerre furent repoussées par les balles de prana à la manière d'une bourrasque de vent.,,飛び交う電刃を、暴風の如き魔弾が叩き伏せる。
17533,"「Ferme-la un peu, j'y penserai le moment venu ! La prochaine fois, j'enverrai le temps emprunté dans le passé ! De cette façon, tu n'auras plus de quoi te plaindre, hein ?!",,「その時はその時で、今度は負債を過去に送ってやるわよ！　それなら文句ないんでしょう！？
17547,"「Tu n'as pas à me le dire, je le sais !",,「言われなくても分かってる！
17596,La faute aux cigarettes japonaises. Elles sont trop bonnes.」,,日本の煙草は旨すぎていけない」
17692,,1,
17693,,1,
17731,Aoko répondit malgré elle au murmure sarcastique de Tōko.,,皮肉げな呟きに、青子はついそんな返答をしてしまった。
17782,,1,
17805,"D'après ce que j'ai entendu, Aozaki lui a lancé une malédiction qu'elle ne pourra pas dissiper facilement. Du coup, elle ne pourra plus revenir dans la ville de Misaki pendant dix ans.",,蒼崎が言うにはそう簡単に解呪できない呪いをかけたから、むこう十年は三咲市には入ってこれないって。
17841,Alice prononça quelques paroles inhumaines avant de se mettre en marche sans un bruit.,,わりと非道な事を言って、有珠は歩きだした。
17881,"「Je vois. Si Aoko l'apprenait, je n'aimerais pas être à ta place.」",,「そう。青子が聞いてたら大変ね」
17982,"On peut facilement obtenir le même résultat avec une Aria d'un verset de gematria, mais comme tu es obsédée par les incantations, tu n'as obtenu qu'un Automate qui n'est même pas capable de voler, triple idiote !」",,あんなの、ゲマトリア一節分の詠唱で同じ効果を出せるのに、あくまで呪術にこだわるから空も飛べない人形になるのよ、バカ姉貴っ！」
18055,"Elle faisait semblant de nous prendre à la légère, mais en réalité, elle était sérieuse depuis le début.」",,甘く見ていたフリで、初めから、余裕なかったんだ」
18140,"S'il était essoufflé et tendu, c'était de sa propre faute.",,呼吸が速いのも、力が入っているのも、偏に自分の責任だ。
18236,「..................,,「………………
18237,Espèce... d'idiot.」,,この、ばか」
18542,「――――――,,「――――――
18543,Hein ?」,,は？」
18602,Recourir au poing implique d'en payer le prix en retour. D'autant plus face à un loup-garou.,,拳を振るうのなら相応の負担がある。まして相手は人狼。
18796,――――――,,――――――
18797,J'ai vraiment été naïve.」,,本当に、甘かった」
18939,Le chemin dont on ne voyait pas la fin s'étirait indéfiniment.,,ゴールの見えない道は延々と続いている。
18951,「Je ne te l'ai pas dit ? Je ne ferais que perdre mon temps inutilement si je marchais seule sur un chemin désert. Je voulais une personne avec qui discuter pour tuer le temps.」,,「言わなかった？　こんな何もない道をひとりで歩くのは時間の無駄でしょ。退屈しのぎに話し相手がほしかったの」
19001,"「Eh bien, personne n'est revenu après avoir atteint la Source. Et ce dans le monde entier.",,「根源に触れて、帰ってきた者は一人もいないの。世界規模でね。
19035,"「Dis-moi, Aozaki, que voulais-tu dire quand tu parlais de la changer en grenouille...」",,「そういえば。カエルにするって、いったい……」
19049,"Et apparemment, j'ai eu recours à cette méthode.",,私がやったのは、その再編成の方みたい。
19114,"Mais ce n'est pas comme si tu allais disparaître, pas vrai ? Après les vacances de Noël, on se reverra à l'école.」",,でも蒼崎が消えるわけじゃないんだろう？　冬休みが終われば、また学校で会えるじゃないか」
19156,…………,,…………
19157,Je n'avais pas poussé la réflexion aussi loin.」,,そこまでは、考えていなかった」
19183,「La vie en montagne n'a rien de spécial.,,「山での暮らしは、別に、どうという事はない。
19184,"Chaque jour ressemblait au précédent, et j'apprenais encore et encore les mêmes choses.",,毎日同じ事を繰り返して、毎日同じ事を教えられた。
19197,"Une fois, j'ai même découvert le corps d'une connaissance au pied d'une falaise, peu de temps après sa disparition.」",,見なくなってしばらくした後、崖の下で見覚えのある遺体を見付けた事もあった」
19201,"「...... En y repensant, ça aussi, c'était étrange.",,「山では、誰も他人から奪うことを考えなかった。
19202,"En montagne, personne ne tentait de voler qui que ce soit. Lorsque je cherchais quelque chose à me mettre sous la dent, il n'y avait que les chiens et les ours qui représentaient un danger, jamais les hommes.",,口にできるものを探す時、気をくばる相手は犬だの熊だのだけで、人を気にする事はなかったんだよ。
19203,"Maintenant, c'est plutôt le contraire.",,今は、その逆になりつつあるけど。
19293,C'est à croire que je ne suis jamais gentille.」,,まるで、普段から優しくないみたいじゃない」
19524,「――――――,,「――――――
19525,Aozaki.」,,蒼崎」
19562,"「Tu vois, Aozaki, en montagne, on a vraiment l'impression de pouvoir toucher les étoiles. On sait que c'est impossible, et pourtant, elles ont l'air si proches qu'on croirait pouvoir les saisir si l'envie nous en prenait.",,「山ではね、蒼崎。星は本当に手が届きそうなんだ。届かないのは分かっていても、望めば掴めそうなぐらい近いのに。
19570,"Mais un jour, c'est probablement la montagne que je comparerai à la ville. Parce que je vis ici maintenant.」",,でも、いつか比べるのは街になってしまうんだろう。自分は、こっちに下りてきてしまったんだから」
19746,"Ouaah, ils sont vraiment inutiles !",,うは、マジ使えないヤツらッスー！
19753,c'est facile de créer un familier plus “fort” que lui.,,本人より“強い”使い魔を造る事は簡単よ。
19774,sa raison d'être se briserait en mille morceaux.,,存在意義も跡形もなく壊れてしまうわ。
19784,"Quant à moi, mon camp est fort, mais le roi lui-même n'a que la capacité de “marcher”.",,わたしは陣営こそ強力だけど、王将自体が「歩」の^能力しかない、というイメージね。
19789,"Aux heures de sport, sa tâche est facile : rester assise à la lisière du campus.",,体育の時間は校庭のはじっこで座っているだけのカ^ンタンなお仕事。
19795,"Même moi, il m'arrive parfois de courir un peu.",,わたしだって、走るだけなら少しはこなせるわ。
19800,"Cette fois aussi, on va commencer la leçon ici,",,今回はここ、アリスさんが指定した
19881,Je suis trop scrupuleuse pour l'exhiber devant l'Association des Mages afin d'en obtenir des privilèges et de l'argent.,,魔術協会に公開して権利と利益を得る、なんて低俗^な事はしていないから。
19908,Guah ?!,,ぐぼぁ!?
19921,"Par exemple,",,貴方のような
19922,brûler des calories toutes les cinq secondes,1,××を罵るのに
19928,,1,
19929,,1,
19930,,1,
19931,,1,
20045,alors la vache doit être une parodie du taureau.,,牛は牡牛座のもじりでしょう。
20048,"Mam'zelle Alice, vous le fabriquez à la chaîne ?",,アリスさん、そのたびに作ってるッスか？
20076,Une règle stipule qu'une sorcière doit créer un Ploy suprême de son vivant.,,魔女はその生で一つ、至高のプロイを遺さないとい^けない決まりがあるから。
20345,que ça ! Vous perdez souvent !,,無敵じゃなかったッスね！　アリスさん、負け星のが多いッス、
20346,"Comme moi, quoi !",,ジブンとおそろッスー！
20395,"Et puis, leurs forces ou mes préférences changeaient quotidiennement.",,どれが強いか、どれが好きかなんて、日によって変わるのだし。
20415,『Celui-ci est Sweets Hearts. Lui Scripps Humpty. Celui-là Diddle Diddle. Et lui Flat Snark. Compris ? Appelle-les comme ça dorénavant.』,,『これはスイーツハーツ。これはスクリプス・ハンプティ。これはディドルディドル。これはフラットスナーク。いい。これからはこの名前で統一するのよ』
20419,"『Et puis, ce genre de noms sera bientôt à la mode. C'est certain. Même si on en aura sûrement rapidement assez.』",,『それに近い将来、こういう名前がトレンドになる時代がくるから。絶対。すぐに飽きられるだろうけど』
20420,"『Il faut leur donner un nom de toute façon, alors autant en profiter. C'est notre originalité à nous. Il faut être à la mode populaire, ce serait du gâchis sinon !』",,『なんで、どうせつけるならイカした方がグッドでバッド。せっかくアタシたちだけのオリジナリティなのよ、ポップに流行らせなくちゃ大損だわ！』
20421,"Depuis, j'appelle les Ploy par des noms. Ça a été dur de tous les retenir, mais je ne me suis plus jamais trompée après ça.",,それ以来、わたしはプロイを名前で呼ぶようになった。いちいち名前を覚える手間はあったけれど、プロイを間違えるコトはなくなったわ。
20444,Je vais peut-être commander un poulet rôti.,,それじゃあ、わたしはフライドチキンにしてもらお^うかしら。
20446,"Le menu ne comporte qu'des hot-dogs, du pop-corn et des frites.",,外のメニュー、ホットドッグとポップコーンとポテ^トしかなかったッスよ。
20451,Ha ha ha. Vous ne l'commandez donc pas pour le manger.,,ハハハ。食事として、頼むワケでは、ないと。
20910,"Suse Ritsuka, à peu près deux ans plus vieille que Tōko, était une Mage dépêchée il y a dix ans en tant qu'observatrice du grand-père de cette dernière―――le Mage ayant découvert la voie vers la Cinquième Vraie Magie.",,橙子より二歳ほど年上の周瀬律架は、十年前から橙子の祖^父―――五番目の魔法の路を発掘した魔術師―――の監視^役として派遣された魔術師だ。
21076,"Ritsuka fait du boycott et les élèves font de moins en moins de bénévolat...... Au bout du compte, je suis la seule à travailler.」",,律架もサボタージュ、奉仕の生徒さんたちも日に日に減っていく一方……結局、労働力は私ひとりだけなのですね」
21214,...... Ils n'aiment pas un ingrédient juste parce qu'il sera bon pour le corps. Les hommes mangent en suivant le concept du plaisir. Voilà pourquoi ce qu'on aime évoque la douceur.」,,"……自分の体に合っているからその食材を好む、ではないんだよ。ヒトは ""楽しい"" か ""楽しくない"" かで食事をとる。好きなものが甘く見えるのはその為だ」"
21344,,1,
21345,"Hōsuke, et également,",1,芳助と、
21494,"Je ne vois pas la source de la détonation, mais...... Yurihiko avait-il l'habitude de manipuler des bombes ? Ça m'étonnerait pas d'un artiste. C'est ce que disait Taro Okamoto, non ?」",,爆発もとは見あたらないけど……ユリヒコ、爆弾で遊ぶ性癖があったとか？　まあ、芸術家らしいけど」
21515,"Quel intérêt aurait-on à utiliser des explosifs...... Quoiqu'avec des bombes télécommandées ou à retardement, on peut mettre à profit le délai avant l'explosion. Les deux types de bombes offrent de nombreuses manières de se créer un alibi.」",,爆発物を使う利点は……そうだな、起爆までのタイムラグを利用した時間操作と、遠隔操作があげられる。どちらも不在証明作りには有利だな」
21588,"Ta supposition me semble plutôt juste, pourtant.」",,今の憶測に間違いはないと思うけど？」
21759,「Spur !,,「スキー跡！
21760,"Le nom de cette pension, ça serait pas Spur, Alice ?!」",,そのペンションの名前、スキー跡とか言わない有珠！？」
21783,"En pensant qu'Aozaki venait à l'école d'ici depuis deux ans, mon admiration ainsi que ma stupéfaction envers sa ténacité allaient encore en grandissant.",,二年以上ここから学校に通っていた蒼崎のタフさに、今更ながら感心するような、呆れるような。
21953,"『Hahaha, j'reconnais bien là notre Riddell. La soudaineté de tes éruptions émotionnelles est toujours aussi intense ! T'es pas embarrassée de dire des choses comme “regardez la vraie moi” ? Non, tu l'es pas, hein ? Trop fort ! Je l'savais ! Riddell, le métier de star te convient mieux que celui de Mage !』",,『ハハハ、さすがリデルさん、感情のオンオフ激しいっスね！　ホントのアタシを見てー、とか、メルヘン全開で恥ずかしくないッスか？　恥ずかしくないんスよね。スゲー、やっぱリデルさん、魔術師よりアイドル向けッス！』
22176,"Dans ce cas, le visage prouverait que le corps n'est pas celui du vieil homme. Le coupable aurait voulu à tout prix cacher les traits du cadavre. Toutefois, brûler le visage jusqu'à le rendre méconnaissable donnerait un indice sur la falsification d'identité.」",,その場合、顔があってはあの死体が土桔氏でない事は明白です。犯人はなんとしても顔を隠したい。しかし、だからといって顔を焼いては、その行為そのものが証拠になります」
22267,「,,「
22268,Qu...,,だ、
22269,Qui,1,誰がっ、
22270,traites-tu de,1,三下、
22271,menu fretiiin !」,1,だっつーのっっっっ！」
22273,「,,「
22274,Ne me sous-estimez...,,舐めんじゃ、
22275,pas !,1,ないわよ！
22276,Ggh,,ぐっ、
22277,"Ce n'est pas un petit arrêt cardiaque,",,心臓止まったぐらいで、
22278,gh,,うぐぅ、
22279,"uuh,",,死んで、
22280,qui...,,死んで
22281,qui va,,たまるもん、
22282,me tuer !」,,かっ！」
22387,"「Hum. J'étais dans le manoir la majeure partie du temps, mais comme j'étais occupé avec les préparatifs, je n'ai pas vraiment eu le temps de parler avec tout le monde.",,「うーん。ほとんど屋敷にいたんだけど、パーティーの準備が忙しくてあまりみんなと話していないな。
22388,Parce que deux personnes dont je tairai le nom ne m'ont pas aidé.,,誰かさんと誰かさんが手伝ってくれないから。
22414,「..................」,,「………………」
22421,"Cependant, comme tout le monde s'était rassemblé à partir de sept heures, l'horaire réel devait se situer quelque part entre quatre et six heures.",,ただし、七時からは全員が集まっていたので、実際には四時から七時までの時間だろう。
22452,"Hmm, enfin, passons. Il existe une autre personne qui remplit la condition consistant à connaître le Ploy, une fille dont la présence ici est peu naturelle. Vous voyez de qui je veux parler, n'est-ce pas ?」",,んー、まあ、それはそれとして、プロイを知っている、って条件ならもう一人、とびきり不自然な娘もいるんだけど。それは誰かが指摘するでしょう」
22839,,1,
22840,,1,
22841,,1,
22842,,1,
22844,,1,
22845,,1,
22846,,1,
22847,,1,
22848,,1,
22970,「Hein ?! N... Non Aozaki ! Ne t'isole pasーーー!」,,「え!?　ダ、ダメだってば蒼崎、ひとりになんな―――！」
22985,Aozaki s'écroula au sol et ne bougea plus d'un pouce.,,蒼崎はそのまま地面に倒れ、ぴくりとも動かない。
23028,"Les chambres d'ami sont reliées à un circuit électrique auxiliaire, alors j'espère que l'électricité y marche encore.」",,客室の配線は別系統だから、まだ電源が生きていればいいけど」
23178,「Hum ? On ne peut pas avoir confiance en Kuonji non plus.,,「ん？　久遠寺は信用できねえだろ。
23229,Yamashiro n'avait visiblement pas pris l'avertissement d'Aozaki très au sérieux.,,蒼崎の忠告を、山城先生はどこまで真剣に受けとめているのだろう。
23247,「Sōjūrō a voulu qu'on l'invite. Il répétait qu'il ferait plaisir à tout le monde aujourd'hui.,,「草十郎が声をかけたんでしょ。アイツ、今日はみんなを喜ばせる、とかはりきってたから。
23286,"On peut considérer que tout le monde est suspect au niveau de l'heure des meurtres, mais ce sens de l'humour se limite à un nombre restreint de personnes. Ma foi, on peut sûrement exclure Sōjūrō, Beo et Kinomi sur ce point-là.」",,殺害可能時間は平等にあっても、そのセンスだけは限られる。この点で言えば、まあ、草十郎やらベオやら木乃美やらは除外される」
23439,Il avait fait semblant de dormir pour me rassurer et était resté éveillé.,,眠ったフリをして、わたしを安心させて、寝ずの番をしていてくれたのだ。
23593,"「Monsieur Yamashiro, auriez-vous perdu la raison ?」",,「山城先生、徹夜明けですか？」
23640,,1,
23641,,1,
23642,,0,
23644,,1,
23646,,1,
23710,"「C'est toi le coupable,",,「アンタが
23711,Shizukiーーーー!」,,犯人ね静希ーーーー！」
24016,Je songeai à une sorte de mauvais présage.,,それは何か、不吉な兆しなのでは、と思った。
24017,Je songeai que laisser ouvert n'était pas très prudent.,,鍵はいつも開けっ放しなのか、と思った。
24018,Je songeai que j'aurais pu aisément venir seule.,,これならひとりでも入れるな、と思った。
24019,Je songeai qu'il valait mieux aller dans le salon.,,このまま居間に移動した方がいいと思った。
24020,Je songeai que je devrais voir ma chambre.,,その前に客室の様子を見た方がいいと思った。
24021,Je songeai que je pourrais me promener sans but particulier.,,意味のない行動をしてみるのもいいと思った。
24022,C'était sinistre. Je songeai qu'il valait mieux rentrer.,,何か不穏。洋館に戻るべきだと思った。
24023,Ça m'intriguait. Je songeai qu'il valait mieux vérifier.,,気になる。確かめてみるべきだと思った。
24024,Je songeai que l'averse risquait d'empirer.,,このまま雨脚は強くなるな、と思った。
24025,Je songeai qu'il risquait de grêler.,,このまま雨は雹になるな、と思った。
24026,Je songeai qu'il vaudrait mieux rentrer chez moi.,,このまま帰ってしまおうか、と思った。
24027,Je songeai que le compte était bon.,,数はあっているな、と思った。
24028,Je songeai que le compte n'était pas bon.,,数を間違えているな、と思った。
24029,Je songeai que je n'avais pas encore vu Shizuki.,,……そういえば、まだ静希を見ていないな、と思った。
