7028,"「Dans notre malheur, on a de la chance qu'il n'y ait pas de rivière ici. S'il y en avait eu une, elle aurait permis l'apparition d'une monstruosité spécialisée dans l'annihilation pure et simple.」",,「遊園地に川がないのは不幸中の幸いね。もしあったら、もっと直接制圧に向いた奴が出てきてた」
7112,"「On dirait qu'on ne peut rien faire, Aozaki !",,「っ、なんかどうしようもないぞ！
7140,"「Aozaki, et si on attrapait cette fille ?!」",,「あの子を捕まえるのは！？」
7168,"「Pas question ! Pour le moment, fuyons !」",,「それはイヤだ！　とりあえず逃げよう！」
7206,"「C'est dommage. Comme il s'agit d'Aoko, je pensais qu'elle serait venue me réduire en cendres avec la tour d'horloge.」",,「青子の事だから、時計台ごと私を焼き払いにくるかと思ったけど」
7259,C'était une des théories de Humpty Dumpty chantée dans Mother Goose.,,それがマザーグースに唄われるハンプティ・ダンプティの一節だ。
7489,「...... Est-ce qu'Aoko est au courant de ça ?」,,「……青子は、それを知っているの？」
7595,"Ça doit bien faire deux jours que tu es dans cette chambre à dormir, il a dû s'affaiblir après tout ce temps.",,まる二日経ってるし、寝てるだけでも体は弱ってるだろうし。
7686,"Tu dis que je suis sous surveillance, mais pourquoi on en est arrivés là ? Pour autant que je sache, je n'ai rien fait de mal, et puis d'abord, tu ne gagneras rien à garder un œil sur moi !",,監視するって言うけど、なんでそんな話になってるんだ？　考えられる範囲、悪いコトとかしてないし、そもそも俺を見張っても得なコトなんていっこもないし！
7687,Tu te trompes sur pas mal de points !」,,蒼崎は色々まちがってる！」
7700,"「Mais ça n'a pas vraiment de sens, non ?",,「けど、それはあまり意味がないんじゃないか？
7721,"C'est bien moins barbare que de vouloir tuer le témoin à tout prix, n'est-ce pas ?",,何でもいいから目撃者を殺す、なんて事より、こっちの方がよっぽど穏便でしょ。
7768,"「Oui. Je fais des mouvements de la main depuis tout à l'heure, et grâce à ça, mon sang a circulé.",,「さっきから手を動かしてたから、血は巡ってる。
7970,"Ce que je n'arrive pas à croire, c'est que vous mettiez la Magie en pratique à la moindre occasion. Il aurait suffi de me dire que c'est quelque chose d'effrayant.",,信じられないのは、なんでいちいち実践するかって事だ。魔術は恐いものなんだって言えば済むだろうに。
7971,"Et aussi, j'ai entendu ta voix menaçante, Aozaki.」",,それと、ぶっそうな蒼崎の声、聞こえてたぞ」
7973,"Mais c'est vrai que je voulais que tu le réalises clairement, et pas seulement avec des mots.",,けど、言葉じゃなくてきちんと実感してもらいたかったのは本当よ。
8060,"「...... Je ne comprends pas trop le mécanisme de la Magie, mais pour résumer, si vous ne la gardez pas secrète, elle s'affaiblit.",,「……魔術の仕組みはよく分からないけど、とにかく自分だけの秘密でないと弱くなるって事か。
8069,"「Et donc, ceux qui ont imposé ces règles à cette bande de types sans valeurs, c'est un rassemblement connu sous le nom d'Association des Mages. C'est comme un syndicat.",,そんなろくでもない連中にルールを敷いたのが、魔術協会っていう集まり。組合みたいなものよ。
8070,L'expression : “Gardez la Magie comme un mystère éternel”...... n'est qu'une règle imposée par ces types pour perpétuer la Magie en tant que telle.」,,“魔術を不朽の神秘とせよ”……というのは、魔術を魔術として永続させるために敷いたルールにすぎないわ」
8089,"L'Association des Mages, dont je parlais à l'instant, est une grande organisation administrant ces gens qui ont continué à exister humblement. Pour les Mages, c'est comme une instance divine.」",,さっき言った魔術協会っていうのは、そんな細々と続いてる連中を束ねる一大組織。魔術師にとって司法の神ってところかしらね」
8090,"「L'Association est divisée en différentes factions, mais la majorité des Mages sont affiliés à l'Association des Mages de Londres.",,「協会も色んな派閥に分かれるんだけど、大抵の魔術師はロンドンの魔術協会に属している。
8098,"en gros, les Mages cachaient leur identité, non pas pour eux-mêmes mais pour la Magie. Seulement, ces derniers temps, il est devenu plus important de cacher sa double vie.",,魔術師が正体を隠すのは自分のためじゃなく魔術のためだったけど、最近では自分の正体を隠すことの方が重要になっている。
8143,"Pour résumer, un Mage est un être inhumain qui fait des expériences magiques dès qu'il en a le temps, et qui peut devenir un monstre ou le diable en personne pour protéger les rites secrets transmis dans sa lignée de Mages―――au sein de sa famille.」",,ともかく、魔術師っていうのは暇さえあれば魔術の実験をしてる連中で―――自分の家系が伝えてきた秘儀を守るためなら鬼でも悪魔にでもなる」
8168,"Normalement, tu devrais être surpris, effrayé, nous ignorer, et finalement faire comme si nous n'existions pas. Alors, pourquoi tu m'as crue lorsque je t'ai dit que j'étais une Magicienne ?」",,普通は驚いたり恐がったり無視したりするものなのに、どうして魔法使いだ、なんて言った私を信じたの？」
8221,"En d'autres termes, vous vous battez pour ces terres ?」",,蒼崎たちは土地の奪い合いをしているんだな？」
8226,"Et puis, on dirait que Shizuki a compris qu'il y a d'autres Mages à part nous.",,静希君も、他に魔術師がいると分かってくれたようだし。
8265,Que pouvait donc bien signifier―――la résolution qu'elle venait d'exprimer―――en réduisant la fiole en morceaux ?,,今の決意表明―――小瓶を粉々にする―――はどういう^事なのか、と。
8266,"「J'ai conclu l'affaire à condition de te faire perdre la mémoire, mais au fond, elle n'est pas d'accord.",,「草十郎には“記憶を無くしてもらう”ってコトで話はつけたけど、心の底から納得してないってコトでしょ。
8324,"Mais comme tu l'as supposé, j'ai déjà fait tout ce qui était en mon pouvoir. À présent, c'est à ton tour de jouer. Tu n'as qu'à agir comme bon te semble.」",,お察しの通り、私のやるべき事はもう終わってるし？　あとは草十郎が努力する番だから、勝手にすれば？」
8513,"...... Et puis, Aoko n'est pas dans une position lui permettant de se préoccuper des gens. Au bout de cinq jours, elle réalisera à quel point sa situation est dangereuse. Ainsi―――」",,……だいたい、青子も人にかまけていられる立場じゃないわ。五日もすれば思い知るでしょう。そうすれば―――」
8558,"Je voudrais que ses fonctions soient uniquement consacrées à la recherche d'intrus, alors s'il est sur le point de s'y égarer, arrête-le.」",,鏡の機能は侵入者の探索に専念させたいし、彼が迷いこみそうになったら止めてあげて」
8634,"D'ailleurs, si tu as des difficultés pour les examens, demande conseil autour de toi. Ça ne sert à rien de s'apitoyer tout seul dans son coin. À l'école, les personnes à qui parler ne manquent pas.」",,また、試験で困ったコトがあったら周りに相談しなさい。ひとりで悩んでいても時間の無駄だよ。ほら、学校っていうのは話し相手にだけは困らないから」
8665,"「Quoi ? Tu parles bien avec les filles de la classe. C'est déjà très bien comme ça, je suis jaloux !",,「クラスの女どもとは話してんじゃん。あれでいいんだっつの、オレは羨ましいっつの。
8750,"Tu fortifies tes défenses, mais tu laisses la porte du château ouverte dans la claire intention d'embrocher ta proie si jamais elle entre par inadvertance. En tant que partenaire, je ne peux pas rester les bras croisés en voyant cela.",,ガチガチに守りをかためて、そのクセ城門だけ開けて、獲物が油断して入ってきたら串刺しにする気満々とか、相棒として見てられないわ。
8788,"「...... Ne t'en fais pas. Je pensais juste que si l'occasion se présentait à nouveau, je voudrais bien revoir un corps humain bouger de cette façon.",,「……気にしないで。機会があるなら、もう一度見たいと思っただけ。
8838,"“Ça prend du temps, mais c'est le plus naturel.",,“こいつは時間がかかるが、もっとも自然だ。
8876,"「Non, je n'aurai sûrement pas fini en une journée, alors j'en achèterai un moi-même.",,「たぶん一日じゃ終わらないから自分で買うよ。
8891,Il salua sa camarade et se dirigea vers le quincaillier.,,少女に礼を言って金物店に向かう。
8917,"le travail,",,アルバイト、
8918,"la sieste, ",,仮眠、
8920,les révisions pour les examens.,,試験勉強。
9321,"「Le seul moment où je la vois, c'est lors des repas, et tu sais à quoi ils ressemblent. Comment veux-tu que nous sympathisions, Aozaki ?」",,「彼女と会えるのは食事の時だけで、食事といったらアレだろう。どうやって仲良くなれって言うんだ」
9325,"「...... Je ne comprends absolument pas, Aozaki.",,「……ぜんぜん分からないな。
9411,"L'une des rares personnes à l'avoir conseillé (malentendus compris), Kinomi Hōsuke, lui avait fait cette suggestion.",,彼の数少ない相談相手（勘違い含む）である木乃美芳助はそんな助言をしてくれた。
9412,"Au passage, la suggestion de Kinomi était à utiliser avec Aoko, mais l'impression de Sōjūrō à ce moment-là avait été :",,ちなみに木乃美の助言は対青子用のものだったが、その時の草十郎の感想は、
9549,"「...... Non. Aozaki devrait bientôt rentrer. Et puis, ce ne sont peut-être pas mes affaires.」",,「……いや。蒼崎も帰ってくるだろうし、いらぬ世話かな」
9793,"Pour moi, vous gâchez de belles occasions de discuter alors que vous vivez au même endroit.」",,せっかく同じ場所に居るのに会話がないなんて、もったいないと思うんだ」
9832,"Je ne peux vraiment pas rester plus longtemps, pensa-t-il avant de mettre un terme à la conversation.",,さすがにこれ以上は延ばせない、と少年は会話を切った。
9947,"Après ce qui s'était passé dans le vestibule, la défiance mêlée d'intérêt qu'Alice ressentait à l'égard de Sōjūrō avait visiblement explosé le compteur, car elle avait exigé qu'Aoko le laisse aussi rentrer seul le lendemain.",,ロビーでの一件で草十郎への不信感、および関心がメーターを振り切ったのか、有珠は“明日も彼をひとりで帰して”と青子に強要した。
9960,"「Aoko, tu me le cachais, n'est-ce pas ?」",,「青子。貴女、隠していたわね」
9966,「Je n'ai pas dit que je te prendrai tout...... Voyons. Que dis-tu de garder 30% ?」,,「なにも全て奪うとは言っていないわ。……そうね。貴女にも三割ぐらいは回すつもり」
9981,"「...... D'accord. Mais, aaah, c'est lamentable. Si j'avais su, j'aurais appris quelques notions d'Alchimie. Comme ça, je n'aurais pas eu à ressentir ce sentiment pitoyable.」",,「……いいけど。あーあ、情けない。こんな事なら錬金術でもかじっておくんだった。そうすれば、こんな思いをしなくてもすんだのに」
9982,「Je n'en suis pas si sûre. Il paraît que les Alchimistes rencontrent des difficultés depuis que la bulle financière a éclaté.」,,「そうでもないわ。彼ら、バブルが弾けて大変だって話よ」
9989,"「...... Non, mais je suis responsable de ne pas l'avoir repéré dans la Barrière, lors de la nuit au parc.",,「……認めてはいないけど、公園での夜、彼を結界で捕捉しなかった責任があるから。
10092,「Je vois. On a tous les deux du mal à trouver comment tuer le temps.」,,「なるほど。時間を持て余しているところも同じだね」
10163,「...... Ça suffit pour réduire autant leur nombre ?,,「……そんな事ぐらいで減るものか？
10408,"J'peux pas accepter ça ! Pourquoi un nouveau venu chez nous devrait, à peine arrivé, être le seul à profiter du regard de Mam'zelle Alice ? Je peux pas laisser passer ça ! Explique-moi ce mystère ! Et ne mens pas. Quand je deviens sérieux, je suis terrible !』",,そのあたりジブン、なんか納得いかないッス。まだうちに入ったばかりの新参ものが、なんでアリスさんの視線をひとりじめしてるっスか？　許せないスけど、その秘訣を教えてほしいっス。切実に。ジブン、本気だしたら凄いッスよ』
10425,Et ça fait mal ! C'est comme si tout mon sang s'écoulait par le coin droit de mon bec !』,,そして痛い、体中の血液がくちばしからこう、右方向に流れていく感覚とかー！』
10490,"「Hyaa ! Cette manière de parler, ne serait-ce pas un certain Tsukiji───!」",,「ひゃあ！　その物言い、槻司某―――！」
10510,"「Oh ! Quoi, alors c'est à propos de la pause ! Tu sais ce qu'il faut dire pour faire plaisir aux gens, Ton Altesse !」",,「お、なんだブレイクかよ！　話せるじゃん、殿下！」
10582,"「Ils viennent de l'étranger. L'amour pour la Grande-Bretagne de leur précédent P.-D.G. leur a porté malheur, et à une époque, ils ont bien failli couler. Mais il y a cinq ans, il a fait déménager leur siège social pour remettre le groupe à flot.",,「ホームグラウンドは国外で、先代の会長の英国びいきがたたって一時期は沈みかけてたんだが、五年くらい前かね。本拠地をこっちに移してからはご存じの通りだ。
10680,"「Mais non. Je retourne continuer le balayage, Tobimaru.」",,「無いよ。戻って掃除の続きをするぞ、鳶丸」
10744,"Il devrait trouver bien plus rapidement la position des Pivots restants, à présent.」",,残りの割り出しは今までより早くなる」
10811,"Si tous les Pivots sont détruits, nous serons finalement assiégées ici......",,支点がすべて潰されたら、いよいよ洋館での籠城になるけど……
10812,"Ça te convient vraiment, Aoko ?」",,いいの、青子？」
10901,"Vous n'avez pas beaucoup dormi après ça, pas vrai ?」",,あれから満足に寝てないだろ、ふたりとも」
11086,"「Voilà. C'est la bonne façon de l'attacher, Aozaki ?」",,「よし。留め方はこれでいいのか」
11254,"Sōjūrō s'inclina légèrement, puis prit les baguettes à la main.",,草十郎は小さくおじぎをしてから箸を手にとった。
11285,"Elle dit parfois des trucs dans le genre, mais j'avais l'impression que ça sonnait faux...... Et donc, j'ai pensé qu'elle n'avait encore jamais commis de meurtre.",,たまにその手の台詞を言うけど、何か違う気がしたんだ。……だからたぶん、蒼崎はまだ人殺しというのを体験していないんじゃないかって。
11298,"...... Oui. Si l'envie lui en prend, Aoko peut porter atteinte à la vie de n'importe qui sans hésitation. Pour le dire à ta façon.」",,……そうね。青子はその気になれば、迷う事なく他人の命に手をだせる。静希君ふうに言うのなら、だけど」
11411,"Et puis, je n'aime pas les hommes intelligents. Pour moi, tout homme devrait être comme Schwarzenegger.」",,顔の良い男は好きじゃないし。やっぱり男はシュワちゃんぐらいじゃないと」
11435,「Pas vraiment. C'est juste qu'il y a de plus en plus de films que j'ai envie de voir. Et ils ne passent pas dans le coin. Et toi ?」,,「別に。見たい映画がたまってるだけ。三咲じゃ上映しない映画をハシゴしたい。蒼崎は？」
11449,"「Kuma, quand j'en aurai fini, viens avec moi au restaurant de ramens de devant la gare.",,「クマ、終わったら駅前のラーメン屋付き合ってよ。
11485,,,「ごめん、木乃美のおかげで僕にも彼女ができました！　彼女の口癖は“木乃美クンよりマシよ
11486,,,”です！」
11502,"「Ouais, la cérémonie d'entrée ! J'ai vu une fille sexy, alors j'ai levé la main par réflexe !",,「おう、入学式な！　すげー身体してる女子がいたからさあ、つい声をかけたんだよな！」
11504,Mais je n'aurais jamais cru que ma main irait aussi loin.,,いや、でもまさか、手が出るとは思わなかった。
11607,"Le Early au réveil, le Breakfast au petit déjeuner, le Elevenses le matin, le Midi Tea Break l'après-midi, l'Afternoon de l'après-midi dans la haute société, le High Tea des soirées mondaines, et l'After Tea après le dîner.",,寝起きのアーリー、朝食のブレックファースト、午前のイレブンジズ、午後のミィディティーブレイク、午後の社交界アフタヌーン、夜会のハイティー、ディナー後のアフターディナー。
11644,"「Ha ha ha. À cause de ça, l'année dernière, on a fini par faire le tour des magasins d'antiquités.」",,「あはは。気が付いたら骨董品回りしてたものね、去年の私たち」
11743,On dit bien que les aristos du Moyen Âge avaient des Alchimistes attitrés qui cherchaient sans relâche un moyen de fabriquer de l'or.」,,ほら、中世の貴族はお抱えの錬金術師で、日夜金を作り出す研究をしてたっていうじゃない!?」
11748,"「...... Aaah. En fin de compte, on ne peut pas leur faire confiance. On prétend que maintenant, les Alchimistes de Prague sont des Mages de la finance, et ceux d'Égypte utilisent de l'or pour fabriquer des armes......」",,「……はあ。錬金術師ほどアテにならない奴はいないってワケか。今じゃプラハの錬金術師は証券魔術師、エジプトの方は兵器作ってるって話だしね……」
11750,"「Les familles huppées de Londres ne mélangent pas préceptes familiaux et affaires, elles préfèrent prendre des disciples spécialisés dans la finance.",,「ロンドンの名門になると、家訓と事業は別物と割り切っていて、金融専門の弟子をとっているわ。
11751,"...... Selon une rumeur, le dirigeant d'un certain conglomérat industriel sucerait le sang de tous ses employés, créant ainsi un réseau au partage d'informations parfait.",,……噂だけど、ある財閥の総帥は社員全員の血を吸って、情報を共有するネットワークを作っているとか。
11816,「...... C'est comme si notre chien domestique venait de nous mordre. Il est drôlement impertinent.」,,「……こういうのを、飼い犬に手を噛まれる、というのかしら。わりと小癪な性格をしていたのね、彼」
11856,"『Et Hutchy le petit prince orphelin, c'est un anime.",,『みつばちマッチはアニメっすね。
11859,"À l'origine, Asics était une société née de la fusion de trois entreprises. Et si on prend les trois présidents ensemble, ça donne six jambes, pas vrai ? C'est pour ça que c'est <Ashi|jambe>, six.」",,アシックスって、もともと三つの会社が合併して出来た会社なのよ。で、三社の社長があつまると足が六本になるじゃない？　だから足、シックス　あくまで俗説だけどね」
11936,"“Si nous désirons trouver le bonheur, arrêtons de nous soucier de la gratitude ou de l'ingratitude et donnons, simplement pour le plaisir de donner.”",,“幸せになりたければ、誰が恩を返した、誰が恩を返さないなどと考えるのはやめて、人に貢献できる喜びを大切にしよう”
11943,"“Les gens riches devraient utiliser leur fortune pour enrichir la société, au lieu de gaspiller leur argent.”",,“富める者は、その富を社会の改善のために使うべきである”
12053,"「―――Tch. C'est vrai, les cigarettes sont...」",,「―――チッ。そうか」
12097,"Il avait pu préserver sa dignité un minimum du fait qu'il était l'enfant d'Hitoyoshi, le fils aîné de Kimekuni. Cela dit, il était aisé d'imaginer quel genre de persécutions avait subies Tobimaru dans sa position délicate, de la part de ses parents et de ses frères et sœurs.",,長男である一義の子という事で最低限の威厳は守られたが、立場の弱い鳶丸が親戚、兄姉たちにどんな迫害を受けたかは想像に難くない。
12213,"Il possède des antiquités indignes de son rang. Aoko et moi, nous nous chargeons donc de les lui subtiliser au compte-gouttes.」",,分不相応にいいアンティークを持っているから、青子と二人で少しずつとりあげているの」
12261,"「Il serait temps que mon père réalise qu'il se fout de lui. C'est à moi qu'il préfère faire les yeux doux, ce salaud de Yankee.",,「親父も舐められてるって気付けよな。親父より先に俺に色目使いやがってクソヤンキーが。
12319,"「Oui, il roule sur l'or comme s'il vendait son corps, genre : “combien pour la nuit” ?」",,「ああ、体でも売ってるとしか思えない羽振りの良さだ。一晩いくら、みたいな」
12593,"Kumari Kojika, secrétaire du conseil étudiant, remit la liste des victimes à Aoko qui s'empressa d'appeler le bipeur de Tobimaru.",,生徒会書記・久万梨金鹿から被害者のリストを受け取って、すぐさま鳶丸の小型無線機に連絡をいれる。
12869,"「Non, c'est vrai. C'est ça, en fait.」",,「いや、そんなもんか、実際」
12880,"「...... Eh bien, je pense que je vais sagement rentrer chez moi.",,「……俺も大人しく家に帰るとするか。
12989,"C'est bon, c'est moi qui paierai. Aujourd'hui, j'ai eu des revenus imprévus, alors soyons fous et dépensons-les.」",,いいわよ、私が出してあげる。今日は臨時収入があったから、パァーッと派手に使いましょう」
12999,"「...... Aaah. Le proverbe dit bien “Bien mal acquis ne profite jamais”, et c'est parfaitement juste. Ma petite rémunération va partir en fumée...」",,「……あーあ。悪銭身に付かずって言うけど、ホントその通り。臨時収入は泡と消えた、か」
13177,"「En fait, j'ai reçu ma paye aujourd'hui.",,「実は今日、給料日だったんだ。
13269,「Sōjūrō. Tu te rappelles de ce qu'a dit Kinomi ?」,,「木乃美くんがなんて言ったか、覚えてる？」
13280,"Euh...... Voyons, pour faire un parallèle, c'est comme un cahier de cours.",,えーと……そうね、喩えるなら授業のノート。
13328,「De grands artistes viendront au Japon dès l'été prochain......,,「来年夏にはビッグアーティストも来日予定……
13329,Pinktrude en fait partie ?!,,って、ピンクトゥルーデが入ってない！？
13572,"Elle devait être dans le début de la vingtaine, mais elle ne lui semblait pas beaucoup plus vieille que lui.",,歳の頃は二十代前半だろうけれど、そう草十郎と歳が離れている気がしない。
13580,"Pour le moment, je garde la maison, mais en fait, je suis un ami d'Aozaki.」",,とりあえず、今は留守番してますけど、実は蒼崎の友人なんです」
13732,"「...... Ce n'est rien. Aoko, avais-tu remarqué que nous étions les seules à être descendues à cette gare ?」",,「……どうもなにも。この駅で降りたのは貴女とわたしだけなの、気付いていた？」
13780,,1,
13837,,1,
13934,"En premier lieu, tant que nous serons influencés par notre égoïsme, même les informations que nous recevons de nos cinq sens resteront subjectives. Le monde entier est dans le brouillard. Et puis, j'ai tendance à ne pas croire ce qui est seulement visuel.」",,そもそも我欲があるかぎり、五感による情報にすら主観が入る。全てこの世は霧の中だ。もともと目に見えるだけのものは信じていない質でね」
14005,,1,
14111,「───Je ne le dirai pas deux fois.,,「―――二度は言わないわ。
14113,"Bien que dissimulées, d'intenses émotions brillaient dans les yeux d'Alice.",,有珠の目には、潜めた、けれど激情が灯っている。
14115,「...... Pardon. Je savais pourtant que cet endroit t'est cher.」,,「……すまない。有珠にとってここが大事な場所なのは、分かってたのに」
14175,"Aaah, en le simplifiant de manière à ce que tu puisses comprendre...... Bah, considère ça comme le soleil.",,あー、草十郎の分かるレベルに落としこむと……ま、太陽みたいなものと考えて。
14210,"Après tout, le but final des Mages, c'est d'atteindre le Tourbillon de la Source, et non pas d'obtenir la Vraie Magie.",,だって、魔術師にとって最終目的は根源の渦への到達であって魔法じゃないし。
